{
  "$schema": "./schemas/reviews.schema.json",
  "$depends_on": ["requirements.json", "architecture.json", "security_review.json", "project_plan.json"],
  "engagement_id": "eng-2026-001",
  "version": "1.0",
  "last_updated": "2026-03-15",
  "status": "complete",

  "reviews": [
    {
      "review_id": "R-001",
      "target_file": "requirements.json",
      "target_version": "1.0",
      "review_date": "2026-03-15",
      "review_type": "quality",
      "scores": {
        "completeness": { "score": 9.0, "max": 10, "notes": "All 7 requirement categories covered. 12 functional requirements with clear acceptance criteria. 7 success criteria with baselines and targets. Comprehensive stakeholder analysis." },
        "technical_soundness": { "score": 8.5, "max": 10, "notes": "IBMi integration requirements well-documented. HIPAA constraints clearly captured. AI suitability correctly assessed as conditional_fit (score 3). Pain points quantified with cost estimates." },
        "well_architected": { "score": 7.5, "max": 10, "notes": "Security and compliance well-addressed. Performance NFRs specified. Scalability projections included. Sustainability not directly addressed at requirements level (appropriate — downstream concern)." },
        "clarity": { "score": 9.0, "max": 10, "notes": "Clear problem statement with current/desired state. Scope boundaries explicit with justification. Assumptions documented. Stakeholder communication preferences specified." },
        "feasibility": { "score": 8.0, "max": 10, "notes": "Budget range ($500K-$1.5M) realistic for scope. 12-18 month timeline feasible with phased approach. Team constraint (5 internal IT) acknowledged with consulting plan. RPG developer retirement risk flagged." },
        "overall": { "score": 8.4, "max": 10, "notes": "Strong requirements document. Comprehensive discovery covering healthcare modernization complexity. HIPAA compliance requirements thoroughly captured." }
      },
      "overall_score": 8.4,
      "pass_fail": "PASS",
      "findings": [
        {
          "id": "RF-001",
          "severity": "medium",
          "category": "completeness",
          "finding": "No explicit data volume growth projections for DB2/400 — '10-15% annual growth' stated in NFRs but not broken down by module or data type.",
          "recommendation": "Add per-module data growth estimates to inform capacity planning in architecture and estimate phases.",
          "status": "open"
        },
        {
          "id": "RF-002",
          "severity": "low",
          "category": "feasibility",
          "finding": "IE11 support constraint (Phase 1 only) may add 10-15% frontend development effort not explicitly quantified.",
          "recommendation": "Quantify IE11 compatibility effort in estimate or remove constraint if client can upgrade workstations before Phase 1.",
          "status": "open"
        }
      ],
      "improvement_plan": [
        {
          "priority": "P2",
          "action": "Add data volume growth projections per module",
          "impact": "medium",
          "effort": "low",
          "validation": "Growth projections present for each of the 6 clinical modules"
        }
      ],
      "blockers": [],
      "iterations": [
        {
          "iteration": 1,
          "date": "2026-03-15",
          "scores": { "score": 8.4, "max": 10 },
          "overall_score": 8.4,
          "pass_fail": "PASS",
          "findings_count": 2,
          "key_changes": []
        }
      ]
    },

    {
      "review_id": "R-002",
      "target_file": "architecture.json",
      "target_version": "1.0",
      "review_date": "2026-03-15",
      "review_type": "quality",
      "scores": {
        "completeness": { "score": 8.5, "max": 10, "notes": "8 components, 6 data flows, 3 Mermaid diagrams, WA scores for all 6 pillars. Tech stack covers all layers. Alternatives considered with clear rejection rationale." },
        "technical_soundness": { "score": 8.5, "max": 10, "notes": "Strangler fig approach well-justified for healthcare risk profile. NestJS/React stack appropriate. IBMi DAL design addresses EBCDIC conversion, connection pooling, and circuit breaker patterns. Redis caching reduces IBMi load." },
        "well_architected": { "score": 7.5, "max": 10, "notes": "WA overall 7.3. Security pillar strong (8.5) given HIPAA focus. Reliability concern: IBMi as single point of failure acknowledged but mitigation limited to client-managed DR. Sustainability lowest (6.5) — acceptable for this engagement type." },
        "clarity": { "score": 8.0, "max": 10, "notes": "Executive summary clear with go/no-go recommendation. Mermaid diagrams effective for system context, deployment, and data flow. Component purposes well-documented." },
        "feasibility": { "score": 8.0, "max": 10, "notes": "Investment range ($750K-$1.2M) aligns with requirements budget. Node.js/IBM i Access integration has community precedent (node-jt400). Blue-green deployment on Fargate is proven pattern." },
        "overall": { "score": 8.1, "max": 10, "notes": "Solid architecture for healthcare IBMi modernization. Key strength: preserves proven RPG business logic while providing modern UI and IAM. Key risk: IBMi connection pool as bottleneck needs load testing." }
      },
      "overall_score": 8.1,
      "pass_fail": "PASS",
      "findings": [
        {
          "id": "RF-003",
          "severity": "high",
          "category": "reliability",
          "finding": "IBMi connection pool limited to 50 concurrent connections. With 500+ users and 50,000 daily transactions, pool exhaustion under peak load is a realistic risk.",
          "recommendation": "Conduct load testing with production-representative data volumes. Consider connection pool sizing based on peak concurrent queries, not users. Implement request queuing as backpressure mechanism.",
          "status": "open"
        },
        {
          "id": "RF-004",
          "severity": "medium",
          "category": "security",
          "finding": "Architecture specifies 'Keycloak or AWS Cognito' for IAM but doesn't resolve the choice. Different security postures and HIPAA compliance paths.",
          "recommendation": "Resolve IdP choice in Foundation phase. Keycloak (self-hosted, full control) vs. Cognito (managed, less configuration). Both support HIPAA with BAA.",
          "status": "open"
        },
        {
          "id": "RF-005",
          "severity": "medium",
          "category": "completeness",
          "finding": "No offline capability design for mobile clinical workflows. FR-009 mentions 'offline capability for basic patient lookup' but architecture doesn't address it.",
          "recommendation": "Add service worker / local storage pattern for critical offline scenarios (patient lookup, medication administration record). Design sync conflict resolution.",
          "status": "open"
        }
      ],
      "improvement_plan": [
        {
          "priority": "P0",
          "action": "Load test IBMi connection pool with production data volumes",
          "impact": "high",
          "effort": "medium",
          "validation": "Load test results showing pool behavior at 2x peak concurrent queries"
        },
        {
          "priority": "P1",
          "action": "Resolve IdP selection (Keycloak vs Cognito)",
          "impact": "medium",
          "effort": "low",
          "validation": "IdP choice documented with HIPAA compliance evidence"
        }
      ],
      "wa_pillar_review": {
        "operational_excellence": { "score": 7.5, "strengths": ["CI/CD pipeline defined", "Structured logging", "Monitoring strategy"], "gaps": ["IBMi-specific runbooks needed", "Knowledge transfer documentation"] },
        "security": { "score": 8.5, "strengths": ["Zero Trust architecture", "HIPAA audit trails", "Encryption everywhere", "MFA/SSO"], "gaps": ["Penetration testing plan", "IdP selection unresolved"] },
        "reliability": { "score": 7.0, "strengths": ["Multi-AZ deployment", "Circuit breakers", "Blue-green deployment"], "gaps": ["IBMi single point of failure", "Connection pool bottleneck risk"] },
        "performance_efficiency": { "score": 7.0, "strengths": ["Redis caching", "CDN for static assets", "Fargate auto-scaling"], "gaps": ["IBMi ODBC latency untested", "No performance benchmark targets"] },
        "cost_optimization": { "score": 7.5, "strengths": ["Fargate pay-per-use", "Storage lifecycle policies", "Caching strategy"], "gaps": ["Fargate vs EC2 cost crossover analysis needed", "IBMi licensing costs excluded"] },
        "sustainability": { "score": 6.5, "strengths": ["Serverless compute", "Caching reduces processing"], "gaps": ["No carbon-aware scheduling", "IBMi power consumption not addressed"] }
      },
      "blockers": [],
      "iterations": [
        {
          "iteration": 1,
          "date": "2026-03-15",
          "scores": { "score": 8.1, "max": 10 },
          "overall_score": 8.1,
          "pass_fail": "PASS",
          "findings_count": 3,
          "key_changes": []
        }
      ]
    },

    {
      "review_id": "R-003",
      "target_file": "security_review.json",
      "target_version": "1.0",
      "review_date": "2026-03-15",
      "review_type": "security",
      "scores": {
        "completeness": { "score": 8.5, "max": 10, "notes": "Full STRIDE analysis with 8 threats. 13 HIPAA compliance entries. 5-layer defense-in-depth. 5 findings with remediation. IAM design with 7 roles." },
        "technical_soundness": { "score": 8.5, "max": 10, "notes": "STRIDE threats realistic for healthcare IBMi modernization. Mitigations are actionable and specific. HIPAA compliance mapping covers key controls. Defense-in-depth layers properly ordered." },
        "well_architected": { "score": 8.0, "max": 10, "notes": "Security pillar well-addressed. Compliance posture documented with specific control status (compliant/partial/non_compliant). Guardrails clearly stated." },